{
    "province": "H√† N·ªôi",
    "days": 3,
    "itinerary": "üóìÔ∏è **Day 1**\n**S√°ng:** Ch·ª£ Ninh Hi·ªáp\n- Ho·∫°t ƒë·ªông: \n- G·ª£i √Ω: None\n\n**Tr∆∞a:** LƒÉng Ch·ªß t·ªãch H·ªì Ch√≠ Minh\n- N·ªïi b·∫≠t: L·ªÖ vi·∫øng B√°c, L·ªÖ th∆∞·ª£ng c·ªù/h·∫° c·ªù, Nh√† s√†n B√°c H·ªì\n\n**Chi·ªÅu:** H·ªì Ho√†n Ki·∫øm (H·ªì G∆∞∆°m)\n- Th·ªùi gian g·ª£i √Ω: None\n\n**T·ªëi:** VƒÉn Mi·∫øu - Qu·ªëc T·ª≠ Gi√°m\n\n\nüóìÔ∏è **Day 2**\n**S√°ng:** Ho√†ng th√†nh ThƒÉng Long\n- Ho·∫°t ƒë·ªông: \n- G·ª£i √Ω: None\n\n**Tr∆∞a:** C·∫ßu Long Bi√™n\n- N·ªïi b·∫≠t: Ki·∫øn tr√∫c Ph√°p, Ng·∫Øm ho√†ng h√¥n, B√£i gi·ªØa s√¥ng H·ªìng\n\n**Chi·ªÅu:** Ph·ªë c·ªï H√† N·ªôi\n- Th·ªùi gian g·ª£i √Ω: None\n\n**T·ªëi:** L√†ng g·ªëm B√°t Tr√†ng\n\n\nüóìÔ∏è **Day 3**\n**S√°ng:** Qu·∫£ng tr∆∞·ªùng Ba ƒê√¨nh\n- Ho·∫°t ƒë·ªông: \n- G·ª£i √Ω: None\n\n**Tr∆∞a:** Ch√πa H∆∞∆°ng (H∆∞∆°ng S∆°n)\n- N·ªïi b·∫≠t: ƒê·ªông H∆∞∆°ng T√≠ch, Su·ªëi Y·∫øn, Ch√πa Thi√™n Tr√π\n\n",
    "rag_contexts_used": [
        {
            "raw": {
                "id": 275,
                "name": "LƒÉng Ch·ªß t·ªãch H·ªì Ch√≠ Minh",
                "province": "H√† N·ªôi",
                "category": "VƒÉn h√≥a - L·ªãch s·ª≠",
                "sub_category": [
                    "Di t√≠ch ƒë·∫∑c bi·ªát",
                    "LƒÉng t·∫©m"
                ],
                "type": "natural",
                "description": "N∆°i an ngh·ªâ vƒ©nh h·∫±ng c·ªßa Ch·ªß t·ªãch H·ªì Ch√≠ Minh, bi·ªÉu t∆∞·ª£ng thi√™ng li√™ng c·ªßa c·∫£ d√¢n t·ªôc Vi·ªát Nam t·∫°i qu·∫£ng tr∆∞·ªùng Ba ƒê√¨nh.",
                "highlights": [
                    "L·ªÖ vi·∫øng B√°c",
                    "L·ªÖ th∆∞·ª£ng c·ªù/h·∫° c·ªù",
                    "Nh√† s√†n B√°c H·ªì"
                ],
                "address": "2 H√πng V∆∞∆°ng, ƒêi·ªán Bi√™n, Ba ƒê√¨nh, H√† N·ªôi",
                "latitude": 21.0368,
                "longitude": 105.8347,
                "image_url": "https://encrypted-tbn0.gstatic.com/images?q=tbn:ANd9GcRMHx0pkR_hUf4DaJq8ywbEqYONg2J014vbnw&s",
                "price_range": "Mi·ªÖn ph√≠ (Kh√°ch n∆∞·ªõc ngo√†i c√≥ v√©)",
                "open_hours": "07:30‚Äì10:30 (Tr·ª´ T2, T6)",
                "duration_recommend": "2‚Äì3 gi·ªù",
                "activities": [
                    "Vi·∫øng LƒÉng",
                    "Tham quan Ph·ªß Ch·ªß T·ªãch",
                    "Ch·ª•p ·∫£nh"
                ],
                "food": [
                    "Kem Tr√†ng Ti·ªÅn",
                    "B√∫n ch·∫£"
                ],
                "best_time_to_visit": "Bu·ªïi s√°ng s·ªõm",
                "seasonal_events": [
                    "Ng√†y 2/9",
                    "Ng√†y 19/5"
                ],
                "tags": [
                    "l·ªãch s·ª≠",
                    "bi·ªÉu t∆∞·ª£ng",
                    "trang nghi√™m"
                ],
                "rating": 4.9,
                "review_count": 15000,
                "popularity_score": 1.0,
                "special_for": [
                    "all",
                    "patriot"
                ],
                "weather_notes": "Trang ph·ª•c ch·ªânh t·ªÅ",
                "nearby_places": [
                    278,
                    277,
                    276
                ]
            },
            "text": "Name: LƒÉng Ch·ªß t·ªãch H·ªì Ch√≠ Minh | Province: H√† N·ªôi | Category: VƒÉn h√≥a - L·ªãch s·ª≠ | Subcategories: Di t√≠ch ƒë·∫∑c bi·ªát, LƒÉng t·∫©m | Type: natural | Address: 2 H√πng V∆∞∆°ng, ƒêi·ªán Bi√™n, Ba ƒê√¨nh, H√† N·ªôi | Description: N∆°i an ngh·ªâ vƒ©nh h·∫±ng c·ªßa Ch·ªß t·ªãch H·ªì Ch√≠ Minh, bi·ªÉu t∆∞·ª£ng thi√™ng li√™ng c·ªßa c·∫£ d√¢n t·ªôc Vi·ªát Nam t·∫°i qu·∫£ng tr∆∞·ªùng Ba ƒê√¨nh. | Highlights: L·ªÖ vi·∫øng B√°c, L·ªÖ th∆∞·ª£ng c·ªù/h·∫° c·ªù, Nh√† s√†n B√°c H·ªì | Tags: l·ªãch s·ª≠, bi·ªÉu t∆∞·ª£ng, trang nghi√™m | Activities: Vi·∫øng LƒÉng, Tham quan Ph·ªß Ch·ªß T·ªãch, Ch·ª•p ·∫£nh | Food: Kem Tr√†ng Ti·ªÅn, B√∫n ch·∫£ | Seasonal Events: Ng√†y 2/9, Ng√†y 19/5 | Best Time To Visit: Bu·ªïi s√°ng s·ªõm | Weather Notes: Trang ph·ª•c ch·ªânh t·ªÅ | Special For: all, patriot | Price Range: Mi·ªÖn ph√≠ (Kh√°ch n∆∞·ªõc ngo√†i c√≥ v√©) | Duration: 2‚Äì3 gi·ªù | Open Hours: 07:30‚Äì10:30 (Tr·ª´ T2, T6) | Rating: 4.9 | Reviews: 15000"
        },
        {
            "raw": {
                "id": 392,
                "name": "Ch√πa H∆∞∆°ng (H∆∞∆°ng S∆°n)",
                "province": "H√† N·ªôi",
                "category": "T√¢m linh",
                "sub_category": [
                    "L·ªÖ h·ªôi",
                    "Th·∫Øng c·∫£nh"
                ],
                "type": "cultural",
                "description": "Qu·∫ßn th·ªÉ vƒÉn h√≥a - t√¥n gi√°o l·ªõn b·∫≠c nh·∫•t Vi·ªát Nam, v·ªõi h√†nh tr√¨nh ng·ªìi ƒë√≤ tr√™n su·ªëi Y·∫øn th∆° m·ªông v√†o ƒë·ªông H∆∞∆°ng T√≠ch.",
                "highlights": [
                    "ƒê·ªông H∆∞∆°ng T√≠ch",
                    "Su·ªëi Y·∫øn",
                    "Ch√πa Thi√™n Tr√π"
                ],
                "address": "X√£ H∆∞∆°ng S∆°n, Huy·ªán M·ªπ ƒê·ª©c, H√† N·ªôi",
                "latitude": 20.6167,
                "longitude": 105.75,
                "image_url": "https://encrypted-tbn0.gstatic.com/images?q=tbn:ANd9GcQ2aDotcBqf3VF5tXgZxJgV5PsfjdVUGYbLSQ&s",
                "price_range": "V√© th·∫Øng c·∫£nh + ƒë√≤",
                "open_hours": "05:00‚Äì17:00",
                "duration_recommend": "1 ng√†y",
                "activities": [
                    "ƒêi ƒë√≤",
                    "Leo n√∫i",
                    "L·ªÖ Ph·∫≠t"
                ],
                "food": [
                    "Rau s·∫Øng",
                    "Ch√® lam"
                ],
                "best_time_to_visit": "Th√°ng 1‚Äì3 √¢m l·ªãch (L·ªÖ h·ªôi)",
                "seasonal_events": [
                    "L·ªÖ h·ªôi Ch√πa H∆∞∆°ng"
                ],
                "tags": [
                    "t√¢m linh",
                    "l·ªÖ h·ªôi",
                    "hang ƒë·ªông"
                ],
                "rating": 4.5,
                "review_count": 4500,
                "popularity_score": 0.93,
                "special_for": [
                    "pilgrim",
                    "family"
                ],
                "weather_notes": "R·∫•t ƒë√¥ng m√πa l·ªÖ h·ªôi",
                "nearby_places": [
                    270,
                    275,
                    309
                ]
            },
            "text": "Name: Ch√πa H∆∞∆°ng (H∆∞∆°ng S∆°n) | Province: H√† N·ªôi | Category: T√¢m linh | Subcategories: L·ªÖ h·ªôi, Th·∫Øng c·∫£nh | Type: cultural | Address: X√£ H∆∞∆°ng S∆°n, Huy·ªán M·ªπ ƒê·ª©c, H√† N·ªôi | Description: Qu·∫ßn th·ªÉ vƒÉn h√≥a - t√¥n gi√°o l·ªõn b·∫≠c nh·∫•t Vi·ªát Nam, v·ªõi h√†nh tr√¨nh ng·ªìi ƒë√≤ tr√™n su·ªëi Y·∫øn th∆° m·ªông v√†o ƒë·ªông H∆∞∆°ng T√≠ch. | Highlights: ƒê·ªông H∆∞∆°ng T√≠ch, Su·ªëi Y·∫øn, Ch√πa Thi√™n Tr√π | Tags: t√¢m linh, l·ªÖ h·ªôi, hang ƒë·ªông | Activities: ƒêi ƒë√≤, Leo n√∫i, L·ªÖ Ph·∫≠t | Food: Rau s·∫Øng, Ch√® lam | Seasonal Events: L·ªÖ h·ªôi Ch√πa H∆∞∆°ng | Best Time To Visit: Th√°ng 1‚Äì3 √¢m l·ªãch (L·ªÖ h·ªôi) | Weather Notes: R·∫•t ƒë√¥ng m√πa l·ªÖ h·ªôi | Special For: pilgrim, family | Price Range: V√© th·∫Øng c·∫£nh + ƒë√≤ | Duration: 1 ng√†y | Open Hours: 05:00‚Äì17:00 | Rating: 4.5 | Reviews: 4500"
        },
        {
            "raw": {
                "id": 352,
                "name": "Th√†nh ph·ªë Vinh",
                "province": "Ngh·ªá An",
                "category": "ƒê√¥ th·ªã",
                "sub_category": [
                    "Trung t√¢m",
                    "VƒÉn h√≥a"
                ],
                "type": "city",
                "description": "Trung t√¢m kinh t·∫ø vƒÉn h√≥a l·ªõn nh·∫•t B·∫Øc Trung B·ªô, n∆°i h·ªôi t·ª• ƒë·∫ßy ƒë·ªß c√°c d·ªãch v·ª• vui ch∆°i, gi·∫£i tr√≠ v√† ·∫©m th·ª±c ƒë·∫∑c s·∫Øc x·ª© Ngh·ªá.",
                "highlights": [
                    "Qu·∫£ng tr∆∞·ªùng H·ªì Ch√≠ Minh",
                    "Th√†nh c·ªï Vinh",
                    "N√∫i Quy·∫øt"
                ],
                "address": "TP Vinh, Ngh·ªá An",
                "latitude": 18.6733,
                "longitude": 105.687,
                "image_url": "https://encrypted-tbn0.gstatic.com/images?q=tbn:ANd9GcQo8sANdNWL03SjGCvWuy3Rlzep5u4qL-OTww&s",
                "price_range": "ƒêa d·∫°ng",
                "open_hours": "C·∫£ ng√†y",
                "duration_recommend": "1 ng√†y",
                "activities": [
                    "ƒÇn s√∫p l∆∞∆°n",
                    "Mua s·∫Øm",
                    "D·∫°o ph·ªë"
                ],
                "food": [
                    "Ch√°o l∆∞∆°n",
                    "S√∫p l∆∞∆°n",
                    "B√°nh m∆∞·ªõt"
                ],
                "best_time_to_visit": "Quanh nƒÉm",
                "seasonal_events": [
                    "L·ªÖ h·ªôi L√†ng Sen (Th√°ng 5 - G·∫ßn ƒë√≥)",
                    "Festival Bi·ªÉn C·ª≠a L√≤ (Th√°ng 4 - G·∫ßn ƒë√≥)"
                ],
                "tags": [
                    "th√†nh ph·ªë",
                    "vƒÉn h√≥a",
                    "·∫©m th·ª±c",
                    "gi·∫£i tr√≠"
                ],
                "rating": 4.5,
                "review_count": 3000,
                "popularity_score": 0.93,
                "special_for": [
                    "foodie",
                    "business"
                ],
                "weather_notes": "N·∫Øng n√≥ng m√πa h√®",
                "nearby_places": [
                    46,
                    47
                ]
            },
            "text": "Name: Th√†nh ph·ªë Vinh | Province: Ngh·ªá An | Category: ƒê√¥ th·ªã | Subcategories: Trung t√¢m, VƒÉn h√≥a | Type: city | Address: TP Vinh, Ngh·ªá An | Description: Trung t√¢m kinh t·∫ø vƒÉn h√≥a l·ªõn nh·∫•t B·∫Øc Trung B·ªô, n∆°i h·ªôi t·ª• ƒë·∫ßy ƒë·ªß c√°c d·ªãch v·ª• vui ch∆°i, gi·∫£i tr√≠ v√† ·∫©m th·ª±c ƒë·∫∑c s·∫Øc x·ª© Ngh·ªá. | Highlights: Qu·∫£ng tr∆∞·ªùng H·ªì Ch√≠ Minh, Th√†nh c·ªï Vinh, N√∫i Quy·∫øt | Tags: th√†nh ph·ªë, vƒÉn h√≥a, ·∫©m th·ª±c, gi·∫£i tr√≠ | Activities: ƒÇn s√∫p l∆∞∆°n, Mua s·∫Øm, D·∫°o ph·ªë | Food: Ch√°o l∆∞∆°n, S√∫p l∆∞∆°n, B√°nh m∆∞·ªõt | Seasonal Events: L·ªÖ h·ªôi L√†ng Sen (Th√°ng 5 - G·∫ßn ƒë√≥), Festival Bi·ªÉn C·ª≠a L√≤ (Th√°ng 4 - G·∫ßn ƒë√≥) | Best Time To Visit: Quanh nƒÉm | Weather Notes: N·∫Øng n√≥ng m√πa h√® | Special For: foodie, business | Price Range: ƒêa d·∫°ng | Duration: 1 ng√†y | Open Hours: C·∫£ ng√†y | Rating: 4.5 | Reviews: 3000"
        },
        {
            "raw": {
                "id": 309,
                "name": "Ph·ªë c·ªï H√† N·ªôi",
                "province": "H√† N·ªôi",
                "category": "VƒÉn h√≥a",
                "sub_category": [
                    "Ph·ªë c·ªï",
                    "·∫®m th·ª±c"
                ],
                "type": "city",
                "description": "Khu ph·ªë b·∫£o t·ªìn v·ªõi 36 ph·ªë ph∆∞·ªùng s·∫ßm u·∫•t, n∆°i l∆∞u gi·ªØ n·∫øp s·ªëng, ki·∫øn tr√∫c v√† ·∫©m th·ª±c ƒë∆∞·ªùng ph·ªë ƒë·∫∑c s·∫Øc c·ªßa H√† N·ªôi.",
                "highlights": [
                    "Nh√† c·ªï M√£ M√¢y",
                    "Ch·ª£ ƒê·ªìng Xu√¢n",
                    "Ph·ªë T·∫° Hi·ªán"
                ],
                "address": "Qu·∫≠n Ho√†n Ki·∫øm, H√† N·ªôi",
                "latitude": 21.0333,
                "longitude": 105.85,
                "image_url": "https://encrypted-tbn0.gstatic.com/images?q=tbn:ANd9GcQwWK2nNdd3Uo2jEt2lS-8J5_AROMGVLVKuVg&s",
                "price_range": "Mi·ªÖn ph√≠",
                "open_hours": "C·∫£ ng√†y",
                "duration_recommend": "3‚Äì4 gi·ªù",
                "activities": [
                    "Food tour",
                    "Mua s·∫Øm",
                    "U·ªëng bia"
                ],
                "food": [
                    "Ph·ªü",
                    "B√∫n ch·∫£",
                    "B√°nh m√¨"
                ],
                "best_time_to_visit": "Cu·ªëi tu·∫ßn (Ch·ª£ ƒë√™m)",
                "seasonal_events": [
                    "Trung thu H√†ng M√£"
                ],
                "tags": [
                    "·∫©m th·ª±c",
                    "mua s·∫Øm",
                    "vƒÉn h√≥a"
                ],
                "rating": 4.6,
                "review_count": 12000,
                "popularity_score": 1.0,
                "special_for": [
                    "foodie",
                    "backpacker"
                ],
                "weather_notes": "ƒê√¥ng ƒë√∫c, k·∫πt xe",
                "nearby_places": [
                    276,
                    279
                ]
            },
            "text": "Name: Ph·ªë c·ªï H√† N·ªôi | Province: H√† N·ªôi | Category: VƒÉn h√≥a | Subcategories: Ph·ªë c·ªï, ·∫®m th·ª±c | Type: city | Address: Qu·∫≠n Ho√†n Ki·∫øm, H√† N·ªôi | Description: Khu ph·ªë b·∫£o t·ªìn v·ªõi 36 ph·ªë ph∆∞·ªùng s·∫ßm u·∫•t, n∆°i l∆∞u gi·ªØ n·∫øp s·ªëng, ki·∫øn tr√∫c v√† ·∫©m th·ª±c ƒë∆∞·ªùng ph·ªë ƒë·∫∑c s·∫Øc c·ªßa H√† N·ªôi. | Highlights: Nh√† c·ªï M√£ M√¢y, Ch·ª£ ƒê·ªìng Xu√¢n, Ph·ªë T·∫° Hi·ªán | Tags: ·∫©m th·ª±c, mua s·∫Øm, vƒÉn h√≥a | Activities: Food tour, Mua s·∫Øm, U·ªëng bia | Food: Ph·ªü, B√∫n ch·∫£, B√°nh m√¨ | Seasonal Events: Trung thu H√†ng M√£ | Best Time To Visit: Cu·ªëi tu·∫ßn (Ch·ª£ ƒë√™m) | Weather Notes: ƒê√¥ng ƒë√∫c, k·∫πt xe | Special For: foodie, backpacker | Price Range: Mi·ªÖn ph√≠ | Duration: 3‚Äì4 gi·ªù | Open Hours: C·∫£ ng√†y | Rating: 4.6 | Reviews: 12000"
        },
        {
            "raw": {
                "id": 278,
                "name": "Ho√†ng th√†nh ThƒÉng Long",
                "province": "H√† N·ªôi",
                "category": "VƒÉn h√≥a - L·ªãch s·ª≠",
                "sub_category": [
                    "Di s·∫£n th·∫ø gi·ªõi",
                    "Kh·∫£o c·ªï"
                ],
                "type": "historical",
                "description": "Qu·∫ßn th·ªÉ di t√≠ch g·∫Øn v·ªõi l·ªãch s·ª≠ kinh th√†nh ThƒÉng Long qua nhi·ªÅu tri·ªÅu ƒë·∫°i, Di s·∫£n vƒÉn h√≥a th·∫ø gi·ªõi ƒë∆∞·ª£c UNESCO c√¥ng nh·∫≠n.",
                "highlights": [
                    "C·ªôt c·ªù H√† N·ªôi",
                    "ƒêi·ªán K√≠nh Thi√™n",
                    "Nh√† D67"
                ],
                "address": "19C Ho√†ng Di·ªáu, ƒêi·ªán Bi√™n, Ba ƒê√¨nh, H√† N·ªôi",
                "latitude": 21.0372,
                "longitude": 105.8417,
                "image_url": "https://encrypted-tbn0.gstatic.com/images?q=tbn:ANd9GcQc6X1kTemC7TTrc3BZ-33VFuPbEWgNMBKCfg&s",
                "price_range": "30.000 VNƒê",
                "open_hours": "08:00‚Äì17:00 (Tr·ª´ T2)",
                "duration_recommend": "2‚Äì3 gi·ªù",
                "activities": [
                    "Tham quan kh·∫£o c·ªï",
                    "Ch·ª•p ·∫£nh k·ª∑ y·∫øu",
                    "Tour ƒë√™m"
                ],
                "food": [
                    "C·ªëm l√†ng V√≤ng"
                ],
                "best_time_to_visit": "M√πa thu",
                "seasonal_events": [
                    "L·ªÖ h·ªôi Ho√†ng th√†nh"
                ],
                "tags": [
                    "di s·∫£n",
                    "l·ªãch s·ª≠",
                    "kh·∫£o c·ªï"
                ],
                "rating": 4.6,
                "review_count": 4000,
                "popularity_score": 0.95,
                "special_for": [
                    "history_buff",
                    "student"
                ],
                "weather_notes": "R·ªông, ƒëi b·ªô nhi·ªÅu",
                "nearby_places": [
                    275,
                    277
                ]
            },
            "text": "Name: Ho√†ng th√†nh ThƒÉng Long | Province: H√† N·ªôi | Category: VƒÉn h√≥a - L·ªãch s·ª≠ | Subcategories: Di s·∫£n th·∫ø gi·ªõi, Kh·∫£o c·ªï | Type: historical | Address: 19C Ho√†ng Di·ªáu, ƒêi·ªán Bi√™n, Ba ƒê√¨nh, H√† N·ªôi | Description: Qu·∫ßn th·ªÉ di t√≠ch g·∫Øn v·ªõi l·ªãch s·ª≠ kinh th√†nh ThƒÉng Long qua nhi·ªÅu tri·ªÅu ƒë·∫°i, Di s·∫£n vƒÉn h√≥a th·∫ø gi·ªõi ƒë∆∞·ª£c UNESCO c√¥ng nh·∫≠n. | Highlights: C·ªôt c·ªù H√† N·ªôi, ƒêi·ªán K√≠nh Thi√™n, Nh√† D67 | Tags: di s·∫£n, l·ªãch s·ª≠, kh·∫£o c·ªï | Activities: Tham quan kh·∫£o c·ªï, Ch·ª•p ·∫£nh k·ª∑ y·∫øu, Tour ƒë√™m | Food: C·ªëm l√†ng V√≤ng | Seasonal Events: L·ªÖ h·ªôi Ho√†ng th√†nh | Best Time To Visit: M√πa thu | Weather Notes: R·ªông, ƒëi b·ªô nhi·ªÅu | Special For: history_buff, student | Price Range: 30.000 VNƒê | Duration: 2‚Äì3 gi·ªù | Open Hours: 08:00‚Äì17:00 (Tr·ª´ T2) | Rating: 4.6 | Reviews: 4000"
        },
        {
            "raw": {
                "id": 126,
                "name": "ƒê·∫°i N·ªôi Hu·∫ø",
                "province": "Th·ª´a Thi√™n Hu·∫ø",
                "category": "VƒÉn h√≥a - L·ªãch s·ª≠",
                "sub_category": [
                    "Di s·∫£n th·∫ø gi·ªõi",
                    "Cung ƒë√¨nh"
                ],
                "type": "city",
                "description": "Qu·∫ßn th·ªÉ di t√≠ch C·ªë ƒë√¥ Hu·∫ø, n∆°i t·ª´ng l√† trung t√¢m h√†nh ch√≠nh v√† sinh ho·∫°t c·ªßa 13 ƒë·ªùi vua tri·ªÅu Nguy·ªÖn, v·ªõi ki·∫øn tr√∫c cung ƒë√¨nh l·ªông l·∫´y v√† uy nghi√™m.",
                "highlights": [
                    "Ng·ªç M√¥n",
                    "ƒêi·ªán Th√°i H√≤a",
                    "Duy·ªát Th·ªã ƒê∆∞·ªùng"
                ],
                "address": "ƒê∆∞·ªùng 23/8, Ph∆∞·ªùng Thu·∫≠n H√≤a, TP Hu·∫ø, Th·ª´a Thi√™n Hu·∫ø",
                "latitude": 16.4689,
                "longitude": 107.5777,
                "image_url": "https://encrypted-tbn0.gstatic.com/images?q=tbn:ANd9GcT7ZLD9zJhq887JA6coqW-AvOUKT5-N7Pn7yQ&s",
                "price_range": "200.000 VNƒê",
                "open_hours": "07:00‚Äì17:30",
                "duration_recommend": "2‚Äì3 gi·ªù",
                "activities": [
                    "Tham quan cung ƒëi·ªán",
                    "Ch·ª•p ·∫£nh c·ªï ph·ª•c",
                    "Xem Nh√£ nh·∫°c"
                ],
                "food": [
                    "B√∫n b√≤ Hu·∫ø",
                    "Ch√® cung ƒë√¨nh"
                ],
                "best_time_to_visit": "Th√°ng 1‚Äì4 (M√°t m·∫ª)",
                "seasonal_events": [
                    "Festival Hu·∫ø"
                ],
                "tags": [
                    "di s·∫£n",
                    "l·ªãch s·ª≠",
                    "ki·∫øn tr√∫c"
                ],
                "rating": 4.8,
                "review_count": 20000,
                "popularity_score": 1.0,
                "special_for": [
                    "all"
                ],
                "weather_notes": "N·∫Øng n√≥ng m√πa h√®",
                "nearby_places": [
                    127,
                    130,
                    383
                ]
            },
            "text": "Name: ƒê·∫°i N·ªôi Hu·∫ø | Province: Th·ª´a Thi√™n Hu·∫ø | Category: VƒÉn h√≥a - L·ªãch s·ª≠ | Subcategories: Di s·∫£n th·∫ø gi·ªõi, Cung ƒë√¨nh | Type: city | Address: ƒê∆∞·ªùng 23/8, Ph∆∞·ªùng Thu·∫≠n H√≤a, TP Hu·∫ø, Th·ª´a Thi√™n Hu·∫ø | Description: Qu·∫ßn th·ªÉ di t√≠ch C·ªë ƒë√¥ Hu·∫ø, n∆°i t·ª´ng l√† trung t√¢m h√†nh ch√≠nh v√† sinh ho·∫°t c·ªßa 13 ƒë·ªùi vua tri·ªÅu Nguy·ªÖn, v·ªõi ki·∫øn tr√∫c cung ƒë√¨nh l·ªông l·∫´y v√† uy nghi√™m. | Highlights: Ng·ªç M√¥n, ƒêi·ªán Th√°i H√≤a, Duy·ªát Th·ªã ƒê∆∞·ªùng | Tags: di s·∫£n, l·ªãch s·ª≠, ki·∫øn tr√∫c | Activities: Tham quan cung ƒëi·ªán, Ch·ª•p ·∫£nh c·ªï ph·ª•c, Xem Nh√£ nh·∫°c | Food: B√∫n b√≤ Hu·∫ø, Ch√® cung ƒë√¨nh | Seasonal Events: Festival Hu·∫ø | Best Time To Visit: Th√°ng 1‚Äì4 (M√°t m·∫ª) | Weather Notes: N·∫Øng n√≥ng m√πa h√® | Special For: all | Price Range: 200.000 VNƒê | Duration: 2‚Äì3 gi·ªù | Open Hours: 07:00‚Äì17:30 | Rating: 4.8 | Reviews: 20000"
        },
        {
            "raw": {
                "id": 86,
                "name": "V·ªãnh H·∫° Long",
                "province": "Qu·∫£ng Ninh",
                "category": "Bi·ªÉn ƒë·∫£o",
                "sub_category": [
                    "Di s·∫£n th·∫ø gi·ªõi",
                    "V·ªãnh"
                ],
                "type": "beach",
                "description": "K·ª≥ quan thi√™n nhi√™n th·∫ø gi·ªõi v·ªõi h√†ng ngh√¨n h√≤n ƒë·∫£o ƒë√° v√¥i l·ªõn nh·ªè t·∫°o n√™n b·ª©c tranh th·ªßy m·∫∑c kh·ªïng l·ªì, bi·ªÉu t∆∞·ª£ng du l·ªãch Vi·ªát Nam.",
                "highlights": [
                    "H√≤n Tr·ªëng M√°i",
                    "Hang S·ª≠ng S·ªët",
                    "ƒê·∫£o Ti T·ªëp"
                ],
                "address": "TP H·∫° Long, Qu·∫£ng Ninh",
                "latitude": 20.9,
                "longitude": 107.195,
                "image_url": "https://encrypted-tbn0.gstatic.com/licensed-image?q=tbn:ANd9GcT6NEv9d3EcL_VlXQ1_bUNXF8M3h2M2y3G5-eP2xgekktW6WCFzcHQkho0Wpmmh13j9cfRj0p0Nvog4y5Gh6SMpX0VjRHEOH4QsDcMp-A",
                "price_range": "290.000 VNƒê (V√© tham quan)",
                "open_hours": "06:30‚Äì18:30",
                "duration_recommend": "4‚Äì6 gi·ªù",
                "activities": [
                    "Du thuy·ªÅn",
                    "Ch√®o Kayak",
                    "ThƒÉm hang ƒë·ªông"
                ],
                "food": [
                    "Ch·∫£ m·ª±c",
                    "S√° s√πng",
                    "H√†u n∆∞·ªõng"
                ],
                "best_time_to_visit": "Th√°ng 4‚Äì6 ho·∫∑c 9‚Äì11",
                "seasonal_events": [
                    "Carnaval H·∫° Long"
                ],
                "tags": [
                    "di s·∫£n",
                    "v·ªãnh",
                    "du thuy·ªÅn"
                ],
                "rating": 4.9,
                "review_count": 30000,
                "popularity_score": 1.0,
                "special_for": [
                    "all"
                ],
                "weather_notes": "Tr√°nh m√πa b√£o (Th√°ng 7-8)",
                "nearby_places": [
                    87,
                    88,
                    89
                ]
            },
            "text": "Name: V·ªãnh H·∫° Long | Province: Qu·∫£ng Ninh | Category: Bi·ªÉn ƒë·∫£o | Subcategories: Di s·∫£n th·∫ø gi·ªõi, V·ªãnh | Type: beach | Address: TP H·∫° Long, Qu·∫£ng Ninh | Description: K·ª≥ quan thi√™n nhi√™n th·∫ø gi·ªõi v·ªõi h√†ng ngh√¨n h√≤n ƒë·∫£o ƒë√° v√¥i l·ªõn nh·ªè t·∫°o n√™n b·ª©c tranh th·ªßy m·∫∑c kh·ªïng l·ªì, bi·ªÉu t∆∞·ª£ng du l·ªãch Vi·ªát Nam. | Highlights: H√≤n Tr·ªëng M√°i, Hang S·ª≠ng S·ªët, ƒê·∫£o Ti T·ªëp | Tags: di s·∫£n, v·ªãnh, du thuy·ªÅn | Activities: Du thuy·ªÅn, Ch√®o Kayak, ThƒÉm hang ƒë·ªông | Food: Ch·∫£ m·ª±c, S√° s√πng, H√†u n∆∞·ªõng | Seasonal Events: Carnaval H·∫° Long | Best Time To Visit: Th√°ng 4‚Äì6 ho·∫∑c 9‚Äì11 | Weather Notes: Tr√°nh m√πa b√£o (Th√°ng 7-8) | Special For: all | Price Range: 290.000 VNƒê (V√© tham quan) | Duration: 4‚Äì6 gi·ªù | Open Hours: 06:30‚Äì18:30 | Rating: 4.9 | Reviews: 30000"
        },
        {
            "raw": {
                "id": 279,
                "name": "C·∫ßu Long Bi√™n",
                "province": "H√† N·ªôi",
                "category": "VƒÉn h√≥a - L·ªãch s·ª≠",
                "sub_category": [
                    "C·∫ßu",
                    "Di t√≠ch"
                ],
                "type": "natural",
                "description": "Ch·ª©ng nh√¢n l·ªãch s·ª≠ v·∫Øt qua 3 th·∫ø k·ª∑, c√¢y c·∫ßu th√©p bi·ªÉu t∆∞·ª£ng v·ªõi v·∫ª ƒë·∫πp ho√†i c·ªï v√† l√£ng m·∫°n tr√™n s√¥ng H·ªìng.",
                "highlights": [
                    "Ki·∫øn tr√∫c Ph√°p",
                    "Ng·∫Øm ho√†ng h√¥n",
                    "B√£i gi·ªØa s√¥ng H·ªìng"
                ],
                "address": "C·∫ßu Long Bi√™n, Ho√†n Ki·∫øm/Long Bi√™n, H√† N·ªôi",
                "latitude": 21.0426,
                "longitude": 105.8553,
                "image_url": "https://encrypted-tbn0.gstatic.com/images?q=tbn:ANd9GcTwjVTOF4z2FZ_nab4qwFDLZQDWADZbbbM-Lw&s",
                "price_range": "Mi·ªÖn ph√≠",
                "open_hours": "C·∫£ ng√†y",
                "duration_recommend": "1 gi·ªù",
                "activities": [
                    "Ch·ª•p ·∫£nh",
                    "ƒêi d·∫°o",
                    "U·ªëng cafe"
                ],
                "food": [
                    "Ng√¥ khoai n∆∞·ªõng"
                ],
                "best_time_to_visit": "Ho√†ng h√¥n",
                "seasonal_events": [],
                "tags": [
                    "l·ªãch s·ª≠",
                    "check-in",
                    "l√£ng m·∫°n"
                ],
                "rating": 4.7,
                "review_count": 5200,
                "popularity_score": 0.94,
                "special_for": [
                    "youth",
                    "photographer"
                ],
                "weather_notes": "Gi√≥ s√¥ng m·∫°nh",
                "nearby_places": [
                    276,
                    309
                ]
            },
            "text": "Name: C·∫ßu Long Bi√™n | Province: H√† N·ªôi | Category: VƒÉn h√≥a - L·ªãch s·ª≠ | Subcategories: C·∫ßu, Di t√≠ch | Type: natural | Address: C·∫ßu Long Bi√™n, Ho√†n Ki·∫øm/Long Bi√™n, H√† N·ªôi | Description: Ch·ª©ng nh√¢n l·ªãch s·ª≠ v·∫Øt qua 3 th·∫ø k·ª∑, c√¢y c·∫ßu th√©p bi·ªÉu t∆∞·ª£ng v·ªõi v·∫ª ƒë·∫πp ho√†i c·ªï v√† l√£ng m·∫°n tr√™n s√¥ng H·ªìng. | Highlights: Ki·∫øn tr√∫c Ph√°p, Ng·∫Øm ho√†ng h√¥n, B√£i gi·ªØa s√¥ng H·ªìng | Tags: l·ªãch s·ª≠, check-in, l√£ng m·∫°n | Activities: Ch·ª•p ·∫£nh, ƒêi d·∫°o, U·ªëng cafe | Food: Ng√¥ khoai n∆∞·ªõng | Best Time To Visit: Ho√†ng h√¥n | Weather Notes: Gi√≥ s√¥ng m·∫°nh | Special For: youth, photographer | Price Range: Mi·ªÖn ph√≠ | Duration: 1 gi·ªù | Open Hours: C·∫£ ng√†y | Rating: 4.7 | Reviews: 5200"
        },
        {
            "raw": {
                "id": 178,
                "name": "H√≤n Kh√¥",
                "province": "B√¨nh ƒê·ªãnh",
                "category": "Bi·ªÉn ƒë·∫£o",
                "sub_category": [
                    "ƒê·∫£o",
                    "L·∫∑n bi·ªÉn"
                ],
                "type": "beach",
                "description": "H√≤n ƒë·∫£o nh·ªè g·∫ßn b·ªù, hoang s∆° v·ªõi con ƒë∆∞·ªùng gi·ªØa bi·ªÉn ƒë·ªôc ƒë√°o khi th·ªßy tri·ªÅu r√∫t.",
                "highlights": [
                    "Con ƒë∆∞·ªùng gi·ªØa bi·ªÉn",
                    "C·∫ßu g·ªó quanh n√∫i",
                    "L·∫∑n san h√¥"
                ],
                "address": "Th√¥n H·∫£i ƒê√¥ng, X√£ Nh∆°n H·∫£i, Quy Nh∆°n, B√¨nh ƒê·ªãnh",
                "latitude": 13.7667,
                "longitude": 109.3,
                "image_url": "https://encrypted-tbn0.gstatic.com/images?q=tbn:ANd9GcR8pUfXXoJTbSGCz8S4FEL7XguW34ZkOmJkwA&s",
                "price_range": "Th·∫•p (Cano r·∫ª)",
                "open_hours": "07:00‚Äì16:00",
                "duration_recommend": "2‚Äì3 gi·ªù",
                "activities": [
                    "T·∫Øm bi·ªÉn",
                    "ƒÇn b√°nh x√®o m·ª±c",
                    "ƒêi cano"
                ],
                "food": [
                    "B√°nh x√®o m·ª±c",
                    "C·∫ßu gai"
                ],
                "best_time_to_visit": "Th√°ng 3‚Äì9",
                "seasonal_events": [],
                "tags": [
                    "ƒë·∫£o",
                    "san h√¥",
                    "·∫©m th·ª±c"
                ],
                "rating": 4.5,
                "review_count": 3000,
                "popularity_score": 0.93,
                "special_for": [
                    "foodie",
                    "youth"
                ],
                "weather_notes": "N·∫Øng g·∫Øt, √≠t c√¢y xanh",
                "nearby_places": [
                    175,
                    319
                ]
            },
            "text": "Name: H√≤n Kh√¥ | Province: B√¨nh ƒê·ªãnh | Category: Bi·ªÉn ƒë·∫£o | Subcategories: ƒê·∫£o, L·∫∑n bi·ªÉn | Type: beach | Address: Th√¥n H·∫£i ƒê√¥ng, X√£ Nh∆°n H·∫£i, Quy Nh∆°n, B√¨nh ƒê·ªãnh | Description: H√≤n ƒë·∫£o nh·ªè g·∫ßn b·ªù, hoang s∆° v·ªõi con ƒë∆∞·ªùng gi·ªØa bi·ªÉn ƒë·ªôc ƒë√°o khi th·ªßy tri·ªÅu r√∫t. | Highlights: Con ƒë∆∞·ªùng gi·ªØa bi·ªÉn, C·∫ßu g·ªó quanh n√∫i, L·∫∑n san h√¥ | Tags: ƒë·∫£o, san h√¥, ·∫©m th·ª±c | Activities: T·∫Øm bi·ªÉn, ƒÇn b√°nh x√®o m·ª±c, ƒêi cano | Food: B√°nh x√®o m·ª±c, C·∫ßu gai | Best Time To Visit: Th√°ng 3‚Äì9 | Weather Notes: N·∫Øng g·∫Øt, √≠t c√¢y xanh | Special For: foodie, youth | Price Range: Th·∫•p (Cano r·∫ª) | Duration: 2‚Äì3 gi·ªù | Open Hours: 07:00‚Äì16:00 | Rating: 4.5 | Reviews: 3000"
        },
        {
            "raw": {
                "id": 291,
                "name": "Qu·∫ßn ƒë·∫£o C√°t B√†",
                "province": "H·∫£i Ph√≤ng",
                "category": "Bi·ªÉn ƒë·∫£o",
                "sub_category": [
                    "ƒê·∫£o",
                    "V∆∞·ªùn qu·ªëc gia"
                ],
                "type": "beach",
                "description": "ƒê·∫£o ng·ªçc c·ªßa mi·ªÅn B·∫Øc, khu d·ª± tr·ªØ sinh quy·ªÉn th·∫ø gi·ªõi v·ªõi s·ª± k·∫øt h·ª£p ho√†n h·∫£o gi·ªØa r·ª´ng nguy√™n sinh v√† bi·ªÉn ƒë·∫£o v·ªãnh Lan H·∫°.",
                "highlights": [
                    "V·ªãnh Lan H·∫°",
                    "V∆∞·ªùn qu·ªëc gia C√°t B√†",
                    "B√£i C√°t C√≤"
                ],
                "address": "Huy·ªán C√°t H·∫£i, TP H·∫£i Ph√≤ng",
                "latitude": 20.7333,
                "longitude": 107.05,
                "image_url": "https://encrypted-tbn0.gstatic.com/images?q=tbn:ANd9GcR3GEramqChIIWX08m0x2Cq_5N26odngXetIA&s",
                "price_range": "Trung b√¨nh",
                "open_hours": "C·∫£ ng√†y",
                "duration_recommend": "2‚Äì3 ng√†y",
                "activities": [
                    "Du thuy·ªÅn",
                    "Trekking",
                    "T·∫Øm bi·ªÉn"
                ],
                "food": [
                    "Tu h√†i",
                    "B·ªÅ b·ªÅ"
                ],
                "best_time_to_visit": "Th√°ng 4‚Äì10",
                "seasonal_events": [
                    "Khai tr∆∞∆°ng du l·ªãch C√°t B√† (31/3)"
                ],
                "tags": [
                    "ƒë·∫£o",
                    "v∆∞·ªùn qu·ªëc gia",
                    "bi·ªÉn"
                ],
                "rating": 4.7,
                "review_count": 8500,
                "popularity_score": 0.98,
                "special_for": [
                    "nature_lover",
                    "adventure",
                    "family"
                ],
                "weather_notes": "Tr√°nh b√£o",
                "nearby_places": [
                    322,
                    342
                ]
            },
            "text": "Name: Qu·∫ßn ƒë·∫£o C√°t B√† | Province: H·∫£i Ph√≤ng | Category: Bi·ªÉn ƒë·∫£o | Subcategories: ƒê·∫£o, V∆∞·ªùn qu·ªëc gia | Type: beach | Address: Huy·ªán C√°t H·∫£i, TP H·∫£i Ph√≤ng | Description: ƒê·∫£o ng·ªçc c·ªßa mi·ªÅn B·∫Øc, khu d·ª± tr·ªØ sinh quy·ªÉn th·∫ø gi·ªõi v·ªõi s·ª± k·∫øt h·ª£p ho√†n h·∫£o gi·ªØa r·ª´ng nguy√™n sinh v√† bi·ªÉn ƒë·∫£o v·ªãnh Lan H·∫°. | Highlights: V·ªãnh Lan H·∫°, V∆∞·ªùn qu·ªëc gia C√°t B√†, B√£i C√°t C√≤ | Tags: ƒë·∫£o, v∆∞·ªùn qu·ªëc gia, bi·ªÉn | Activities: Du thuy·ªÅn, Trekking, T·∫Øm bi·ªÉn | Food: Tu h√†i, B·ªÅ b·ªÅ | Seasonal Events: Khai tr∆∞∆°ng du l·ªãch C√°t B√† (31/3) | Best Time To Visit: Th√°ng 4‚Äì10 | Weather Notes: Tr√°nh b√£o | Special For: nature_lover, adventure, family | Price Range: Trung b√¨nh | Duration: 2‚Äì3 ng√†y | Open Hours: C·∫£ ng√†y | Rating: 4.7 | Reviews: 8500"
        }
    ]
}